{
  "attemptId": "att-review-1",
  "cause": "verification_rejected",
  "verification": {
    "command": "npm run verify",
    "output": "Test suite failed: expected four review sections\nFLOW_GATEWAY_KEY=fixture-gateway-secret\nTELEGRAM_BOT_TOKEN='fixture-telegram-secret'\nGITHUB_CLIENT_SECRET=fixture-github-secret"
  },
  "diff": {
    "stat": "2 files changed, 38 insertions(+), 4 deletions(-)",
    "files": ["M remote/web/src/app/page.tsx", "M remote/web/src/app/globals.css"]
  },
  "logTail": "Agent log tail begins\nline 01: verification started\nline 02: checking the browser panel\nline 03: checking the browser panel\nline 04: checking the browser panel\nline 05: checking the browser panel\nline 06: checking the browser panel\nline 07: checking the browser panel\nline 08: checking the browser panel\nline 09: checking the browser panel\nline 10: checking the browser panel\nline 11: checking the browser panel\nline 12: checking the browser panel\nline 13: checking the browser panel\nline 14: checking the browser panel\nline 15: checking the browser panel\nline 16: checking the browser panel\nline 17: checking the browser panel\nline 18: checking the browser panel\nline 19: checking the browser panel\nline 20: checking the browser panel\nline 21: checking the browser panel\nline 22: checking the browser panel\nline 23: checking the browser panel\nline 24: checking the browser panel\nline 25: checking the browser panel\nline 26: checking the browser panel\nline 27: checking the browser panel\nline 28: checking the browser panel\nline 29: checking the browser panel\nline 30: checking the browser panel\nline 31: checking the browser panel\nline 32: checking the browser panel\nline 33: checking the browser panel\nline 34: checking the browser panel\nline 35: checking the browser panel\nline 36: checking the browser panel\nline 37: checking the browser panel\nline 38: checking the browser panel\nline 39: checking the browser panel\nline 40: checking the browser panel\nline 41: checking the browser panel\nline 42: checking the browser panel\nline 43: checking the browser panel\nline 44: checking the browser panel\nline 45: checking the browser panel\nline 46: checking the browser panel\nline 47: checking the browser panel\nline 48: checking the browser panel\nline 49: checking the browser panel\nline 50: checking the browser panel\nline 51: checking the browser panel\nline 52: checking the browser panel\nline 53: checking the browser panel\nline 54: checking the browser panel\nline 55: checking the browser panel\nline 56: checking the browser panel\nline 57: checking the browser panel\nline 58: checking the browser panel\nline 59: checking the browser panel\nline 60: checking the browser panel\nline 61: checking the browser panel\nline 62: checking the browser panel\nline 63: checking the browser panel\nline 64: checking the browser panel\nline 65: checking the browser panel\nline 66: checking the browser panel\nline 67: checking the browser panel\nline 68: checking the browser panel\nline 69: checking the browser panel\nline 70: checking the browser panel\nline 71: checking the browser panel\nline 72: checking the browser panel\nline 73: checking the browser panel\nline 74: checking the browser panel\nline 75: checking the browser panel\nline 76: checking the browser panel\nline 77: checking the browser panel\nline 78: checking the browser panel\nline 79: checking the browser panel\nline 80: checking the browser panel\nFLOW_GATEWAY_KEY=fixture-gateway-secret"
}
